status,respondent,pet_advocate,ref_url,resp_advocate,case_no,PartyYear,listed_on,PartyStatus,case_number,diary_no,category,u_section,partyName,petitioner,admitted,act,present_last
"  Status/Stage   Pending - (Motion Hearing   [SERVICE/COMPLIANCE]-BEFORE REGISTRAR(J)  / [FRESH (FOR ADMISSION) - CIVIL CASES]) List along with case, Notice status quo-Ord dt:02-02-2018 ","1 HARIDASAN. V S/D/W/Thru:- SANKARAN NAIR V. VADAKKOTTU HOUSE, THIRUVENKIDAM  , DISTRICT: GURUVAYUR ,Thrissur            , KERALA             2 THE GURUVAYUR  DEVASWOM MANAGING  COMMITTEE ADMINISTRATOR KERALA  ,Thrissur            , KERALA             3 THE ADMINISTRATOR GURUVAYUR DEVASWOM  ,Thrissur            , KERALA             4 THE COMMISSIONER GURUVAYUR DEVASWOM  ,Thrissur            , KERALA             5 VINEETH P.   ASSISTANT LINEMAN GURUVAYUR DEVASWOM  ,Palakkad            , KERALA             6 VYSAKH K. LOWER  DIVISION CLERK ASSISTANT LINEMAN GURUVAYUR DEVASWOM  ,Thrissur            , KERALA             7 SIJIL T.P.  ASSISTANT LINEMAN GURUVAYUR DEVASWOM  ,Thrissur            , KERALA             8 RESHMA  SURESH P. LOWER DIVISION CLERK GURUVAYUR DEVASWOM RESIDING AT  THEKKEKATTIL  HOUSE  CHEMMANNUR  VIA  ,Thrissur            , KERALA             9 SUNEESH P. LOWER DIVISION CLERK RESIDING AT NEELAMPILLLY HOUSE MANIRHARA AVANOOR P.O.  THRISSUR  ,Thrissur            , KERALA             10 SAJITHA N.  LOWER DIVISION CLERK RESIDING AT PUTHANVEETTIL HOUSE  EAST GATE  PUNNATHUR ROAD  ,Thrissur            , KERALA             11 BINU G.G.  PLUMBER GURUVAYUR DEVASWOM   AT GOSAL  HOUSE CHERAI P.O.  ,Ernakulam            , KERALA             12 PRADEEP KUMAR K GURUVAYUR RESIDING AT  KANIYATTIL  HOUSE  THIRUMITTAKKODE  OTTAPPALAM  ,Palakkad            , KERALA             13 K. PADMAKUMAR KSHETHRAM  ADIYANTHRAM RESIDING AT KIZHAKKE  VEETTIL PANANGATTUKARA  ,Thrissur            , KERALA             14 KRISHNA PRASAD K. HELPER  ELECTRICAL SECTION RESIDING AT  KANDIRINGATH  HOUSE MALLISSERY PARAMBU GURUVAYUR P.O.  ,Thrissur            , KERALA             15 ASWIN V.S. ASSISTANT LINEMAN RESIDING AT VATTANATTU  THODIYIL  HOUSE  ,Malappuram            , KERALA             16 GOPULAL P.N. ASSISTANT LINEMAN RESIDING AT POTHENKKATTY  HOUSE  ENGADIYUR P.O.  ,Thrissur            , KERALA             17 JAYARAJ P HELPER           ELECTRICAL SECTON RESIDING AT PATTILACHAN  HOUSE  KANJIRAKKODE P.O.  ,Thrissur            , KERALA             18 VIBIN K.V. HELPER  ,ELECTRICAL SECTION RESIDING AT KODANI  HOUSE  CHOONDAL  P.O.  ,Thrissur            , KERALA             19 AJAYAKUMAR  C.V. HELPER   ELECTRICAL SECTION  ,Thrissur            , KERALA             20 SUNIL P.S. HELPER  ,ELECTICAL SECTION RESIDING AT PUNCHADATH HOUSE  MOORKANIKKARA  ,Thrissur            , KERALA             21 SALJITH T.K. HELPER ELECTRICAL SECTION RESIDING AT  THOTTUPURATH HOUSE  KOTTAPPADI  ,Thrissur            , KERALA             22 RAJEESH K.G. PLUMBER RESIDING AT KUNNATHUKADU  HOUSE  KAJIRAMKODE P.O.  ,Thrissur            , KERALA             23 DHANEESH B. ASSISTANT LINEMAN RESIDING AT POTTEKKATT  HOUSE   TAVANOOR P.O.  ,Malappuram            , KERALA             24 KANNAN P. ASSISTANT LINEMAN RESIDING AT  POTTEKKATT HOUSETAVANOOR  P.O.  MALAPPURAM  ,Malappuram            , KERALA             25 T.P. SUBRAMANYAN HELPER ELECTRICAL SECTION RESIDING AT  GURUVAYOOR  DEVASWOM BOARD  THANIKKATTIL  PALLITALIL  HOUSE   VALIYAKUNNU  P.O.  ,Malappuram            , KERALA             26 REMADEVI N. LOWER DIVISION CLERK RESIDING AT  PULICHERY  HOUSE  EDAKALATHGUR  P.O.  PARAPPUR  ,Thrissur            , KERALA             27 M.G.  PRAJEESH ASSISTANT LINEMAN RESIDING AT  MARAKKATH HOUSE CHERUVATHANI  P.O.  ,Thrissur            , KERALA             28 K.V.  SATHEESH KUMAR PLUMBER RESIDING AT AMBAZHAKKAD  HOUSE  ERUMAPETTY  P.O.  ,Thrissur            , KERALA             29 KRISHNAKUMAR  P. HELPER ELECTRICAL SECTION RESIDING AT MADACHILATH  HOUSE THEKKUKARA  P.O.  ,Thrissur            , KERALA             30 THE KERALA  DEVASWOM  RECRUITMENT BOARD SECRETARY KERALA  ,Thiruvananthapuram            , KERALA             31 GURUVAYUR  DEVASWOM MANAGING COMMITTEE   THE ADMINISTRATOR KERALA  ,Thrissur            , KERALA             32 THE ADMINISTRATOR GURUVAYUR DEVASWOM  ,Thrissur            , KERALA             33 THE CHAIRMAN        GURUVAYUR DEVASWOM  MANAGING COMMITTEE KERALA  ,Thiruvananthapuram            , KERALA            ",RANJITH K. C.,http://www.supremecourtofindia.nic.in/php/case_status/case_status_process.php?d_no=94&d_yr=2018,,SLP(C) No. 003844 - 003846 / 2018Registered on 03-02-2018,2018,  Tentatively case may be listed on  (likely to be listed on)   05-02-2018  (Computer generated),P,1,94/2018  Filed on 04-01-2018 12:30 PM PENDING   [SECTION:  XI-A ],  Category   0602-Service Matters : Regularisation of ad-hoc employees etc., ,lakshmi,"1 RANJITH K. SYSTEM ANALYST, GURUVAYUR DEVASWOM GURUVAYUR KOZHISSERY HOUSE, MEENADATHUR PO THANALOOR VIA  , DISTRICT: MALAPPURAM ,Malappuram            , KERALA             2 V. SANTOSHKUMAR DRIVER GURUAYOOR  DEVASOM  , , KERALA             3 V. ABHILASH DRIVER GURUVAYUR DEVASWOM  , , KERALA             4 SHEEBA  P.G. DATA ENTRY OPERATOR GURUVAYUR DEVASWOM  , , KERALA             5 SARIKA P.S. DATA ENTY OPERATOR GURUVAYUR  DEVASWOM  , , KERALA             6 JEEVA LAKSHMI ASSISTANT LIBRARIAN GURUVAYUR DEVASWOM  , , KERALA            ",,,  Present/Last Listed On   02-02-2018  [ HON'BLE MR. JUSTICE KURIAN JOSEPH and HON'BLE MR. JUSTICE MOHAN M. SHANTANAGOUDAR ]
"  Status/Stage   Pending - (Motion Hearing   [FRESH (FOR ADMISSION) - CIVIL CASES]) Notice Returnable (D:0,W:2,M:0)-Ord dt:12-03-2018 ","1 HINDU COMMUNITY IN GENERAL AND CITIZENS OF GOBICHETTIPALAYAM  REPRESENTED BY SENNIAPPA CHETTIAR REPRESENTED BY SENNIAPPA CHETTIAR HANUMANTHARAYAN KOIL STREET, GOBICHETTIPALAYAM TOWN  , , TAMIL NADU          2 COMMISSIONER HINDU RELIGIOUS AND CHARITABLE ENDOWMENT FORT ST. GEORGE  , , TAMIL NADU          3 REVENUE DIVISIONAL OFFICWER GOPICHETTIPALAYAM DIVISION  , DISTRICT: GOPICHETTIPALAYAM , , TAMIL NADU          4 G. K. PERUMAL (DEAD) THROUGH LRS.  ,Erode          , TAMIL NADU          4.1 RAMAYA S/D/W/Thru:- LATE SHRI G. K. PERUMAL 15/29, RAJAJI STREET, MAIN BAZAR  , DISTRICT: GOPICHETTIPALAYAM ,Erode          , TAMIL NADU          4.2 P. SUBRAMANIAN S/D/W/Thru:- LATE SHRI G. K. PERUMAL 92/255, SIVASHANMUGAM ROAD, PUDUPALAYAM  , DISTRICT: GOPICHETTIPALAYAM ,Erode          , TAMIL NADU          4.3 P. RAJENDRAN S/D/W/Thru:- LATE SHRI G. K. PERUMAL 31/111, NEW HOSPITAL ROAD  , DISTRICT: GOPICHETTIPALAYAM ,Erode          , TAMIL NADU          4.4 P. KANDASAMY S/D/W/Thru:- LATE SHRI G. K. PERUMAL 15/29, RAJAJI STREET, MAIN BAZAR  , DISTRICT: GOPICHETTIPALAYAM ,Erode          , TAMIL NADU          4.5 P. MUTHAIYAN S/D/W/Thru:- LATE SHRI G. K. PERUMAL 32-A, MATHESWARAN KOIL STREET  , DISTRICT: GOPICHETTIPALAYAM ,Erode          , TAMIL NADU          4.6 G. P. SOMASUNDARAM S/D/W/Thru:- LATE SHRI G. K. PERUMAL 31/24, SACRED STREET  , DISTRICT: GOPICHETTIPALAYAM ,Erode          , TAMIL NADU          4.7 G. P. MITHRI S/D/W/Thru:- LATE SHRI G. K. PERUMAL W/O D. CLARENCE1117, MAIN ALWARE3TTAI  , DISTRICT: COONNORE ,Erode          , TAMIL NADU          4.8 P. SAKUNDALA S/D/W/Thru:- LATE SHRI G. K. PERUMAL W/O N. CHARLES3/311, ANNA NAGAR  , DISTRICT: THALAMPATTI ,Erode          , TAMIL NADU          4.9 M. SIVAKAMI S/D/W/Thru:- LATE SHRI G. K. PERUMAL W/O M. P. MOHANASUNDARAM,106, MILL ROAD  , DISTRICT: GOPICHETTIPALAYAM ,Erode          , TAMIL NADU          4.10 S. MARUTHAMANI S/D/W/Thru:- LATE SHRI G. K. PERUMAL W/O SHANMUGASUNDRAM3/225, TANK STREET  , DISTRICT: ARASUR PUDUR ,Erode          , TAMIL NADU          5 RAMAYAMMAL S/D/W/Thru:- LATE SHRI G. K. PERUMAL DOOR NO. 28, NEW HOSPITAL STREET  , DISTRICT: GOPICHETTIPALAYAM , , TAMIL NADU          6 THIRUGNANA SAMBANDAM GNANASUNDARAM BOOK BINDNG WORKS, DOOR NO. 30  , DISTRICT: CUTHCRY STREET , , TAMIL NADU          7 T. M. NATARAJAN CORRESPONDENT GANDHI KALVI NILAYAM  , DISTRICT: GOBI TOWN , , TAMIL NADU          8 DINAKARAN PROPRIETOR KAMADHENU TEA STALL, DOOR NO. 24, CART STREET  , DISTRICT: GOBI , , TAMIL NADU          9 DR.M.R.SUBBAIYAN  DEAD  ,Thiruvarur          , TAMIL NADU          9.1 DR.M.R.SUBBAIYAN  DEAD S/D/W/Thru:- SMT SARASWATHY DEVI SHIR DR. M.R. SUBBAIYAN  NO. 148 , CUTCHERY STREET, GOPICHETTIPALAYAM-638452  , DISTRICT: GOPICHETTIPALAYAM ,Thiruvarur          , TAMIL NADU          9.2 DR.M.R.SUBBAIYAN  DEAD S/D/W/Thru:- DR. P.KAMALAKANNAN NO.133, SRI SARADA HOSPITAL , POOMGA NAGAR MAIN ROAD , ARANTHAGI- 614616  , DISTRICT: ARANTHAGI ,Thiruvarur          , TAMIL NADU          9.3 DR.M.R.SUBBAIYAN  DEAD S/D/W/Thru:- DR. M.RVENKATESAN NO.36/512 A, ROYAL TENESAN APARTMENTS, PATTABIRAMANPILLAI STREET, THENNUR, TRICHY-17  , DISTRICT: CHENNAI ,Thiruvarur          , TAMIL NADU          10 NARAYANAIYER VIJAYA CAFE, BAZAR STREET ,GOBI TOWN  ,Chennai          , TAMIL NADU          11 K.V.NARASIMHAN, SADSIVARAO STREET, GOBI TOWN  ,Chennai          , TAMIL NADU          12 P.SIVAKUMAR. NO. 82, CUTCHERY STREET, GOBI TOWN.  ,Chennai          , TAMIL NADU          13 ARULMIGHUDHANDAYUTHAPANI SWAMI THIRUKOIL REP. BY ITS DY. COMMISSIONER/ EXECUTIVE OFFICER , PALANI , MADURAI DISTRICT.  ,Chennai          , TAMIL NADU          14 G.S. LAKSHMANAN (DEAD)  ,Chennai          , TAMIL NADU          14.1 G.L.SRINIVASAN S/D/W/Thru:- LATE SHRI G.S.LAKSHMANAN FLAT NO. 120, 4TH WING, 1 FLOOR, KTVR VIJAY DEEPA GREEN FIELD APARTMENTS, VELANDIPALAYAM,  , DISTRICT: VELANDIPALAYAM ,Chennai          , TAMIL NADU          14.2 G.LSUNDARAVADIVELAN S/D/W/Thru:- LATE SHRI G.S. LAKSHMANAN 60, DEVARAJMAHAL BAZAR STREET GOPICHETTIPALAYAM, ERODE  , DISTRICT: CHENNAI ,Chennai          , TAMIL NADU          14.3 SWARNA BALA S/D/W/Thru:- LATE SHRI G.S. LAKSHMANAN 201, MAEBLE ARCH , 94, PALI HILL ROAD ,BANDRA , MUMBAI-50 MAHARASHTRA  ,Chennai          , TAMIL NADU          14.4 G.L.SEETHA LAKSHMI S/D/W/Thru:- LATE SHRI G.S.LAKSHMANAN 10, SUNDARNIVAS, PARASAL THURAI ROAD, RANGASAMUDRAM,SATHYYAMANGALAM ERODE  ,Chennai          , TAMIL NADU          15 N.R. THIRUVENKADAM  NALLAGOUNDEMPALAYAM HAMLAT OF LAKKAMPATTI VILLAGE GOPICHETTIPALAYAM  ,Chennai          , TAMIL NADU          16 N.T.GOBIKRISHNAN  NALLAGOUNDEMPALAYAM HALMET OF LAKKAMPATTI VILLAGE GOPICHETTIPALAYAM  ,Coimbatore          , TAMIL NADU          17 JEYASUDHA NALLAGOUNEMPALAYAM HAMLET OF LAKKAMPATTI VILLAGE  GOPICHETTIPALAYAM ERODE  ,Chennai          , TAMIL NADU          18 ARULMIGHU DHANDAYUTHAPANISWAMI TIRUKOIL BY ITS DEPUTY COMMISSIONER, EXECUTIVE OFFICER  , DISTRICT: PALANI ,Madurai          , TAMIL NADU          19 THIRUGNANASAMBANDAM DOOR NO. 30, CUTCHERY STREET  , DISTRICT: GOBICHETTIPALAYAM ,Erode          , TAMIL NADU          20 T. M. NATARAJAN CORRESPONDENT, GANDHI KALVI NILAYAM  , DISTRICT: GOBICHETTIPALAYAM ,Erode          , TAMIL NADU          21 DINAKARAN KAMADHENU TEA SHOP OWNER, DOOR NO. 24, CAR STREET  , DISTRICT: GOBICHETTIPALAYAM ,Erode          , TAMIL NADU          22 DR. M. R. SUBBAIYAN 247, MAIN ROAD  , DISTRICT: GOBICHETTIPALAYAM ,Erode          , TAMIL NADU          23 NARAYANA IYER VIJAYACAFE, BAZAR STREET  , DISTRICT: GOBICHETTIPALAYAM ,Erode          , TAMIL NADU          24 K. V. NARASIMHAN PETTI SHOP OWNER, SADASIVA RAO STREET  , DISTRICT: GOBICHETTIPALAYAM ,Erode          , TAMIL NADU          25 DEIVATHAL (DEAD) THROUGH LRS.  ,Erode          , TAMIL NADU          25.1 N. R. THIRUVENKADAM NALLAGOUNDEMPALAYAM HAMLET OF LAKKAMPATTI VILLAGE  , DISTRICT: GOBICHETTIPALAYAM ,Erode          , TAMIL NADU          25.2 N. T. GOBIKRISHNAN NALLAGOUNDEMPALAYAM HAMLET OF LAKKAMPATTI VILLAGE  , DISTRICT: GOBICHETTIPALAYAM ,Erode          , TAMIL NADU          25.3 RAMAMORTHY THIRUVENKADAM NALAGOUNDEMPALAYAM HAMLET OF LAKKAMPATTI VILLAGE  , DISTRICT: GOBICHETTIPALAYAM ,Erode          , TAMIL NADU          26 DR. K. S. PALANISAMI E. N. T SPECIALIST CUTCHERY STREET, OPPOSITE TO TALUK OFFICE  , DISTRICT: GOBICHETTIPALAYAM ,Erode          , TAMIL NADU          27 P. SIVAKUMAR 82, CUTCHERY STREET  , DISTRICT: GOBICHETTIPALAYAM ,Erode          , TAMIL NADU          28 G. S. LAKSHMANAN BAZAAR STREET  , DISTRICT: GOBICHETTIPALAYAM ,Erode          , TAMIL NADU         ",S. RAJAPPA,http://www.supremecourtofindia.nic.in/php/case_status/case_status_process.php?d_no=3684&d_yr=2018,,MA 000548 - 000549 / 2018Registered on 05-03-2018,2018,  Tentatively case may be listed on  (likely to be listed on)   28-03-2018  (Computer generated),P,15,3684/2018  Filed on 30-01-2018 04:40 PM PENDING   [SECTION:  XII ],  Category   2604-Personal Law Matters : Matters relating to testamentary succession, ,lakshmi,"1 K.S. PALANISAMY (DEAD) THROUGH LRS E.N.T. SPECIALIST CUTCHERY STREET, OPP. TALUK OFFICE, GOBI  , , TAMIL NADU         ",,,  Present/Last Listed On   12-03-2018  [ HON'BLE MR. JUSTICE A.K. SIKRI and HON'BLE MR. JUSTICE ASHOK BHUSHAN ]
  Status/Stage   Pending - (Motion Hearing   [DEFAULT / OTHER MATTERS] / [FRESH (FOR ADMISSION) - CIVIL CASES]) Peremptory order (in days) (30)-Ord dt:19-02-2018 ,********,G.SIVABALAMURUGAN,http://www.supremecourtofindia.nic.in/php/case_status/case_status_process.php?d_no=3806&d_yr=2018,,SLP(C) No. 004389 -  / 2018Registered on 07-02-2018,2018,  Tentatively case may be listed on  (likely to be listed on)   13-04-2018  (Computer generated),P,16,3806/2018  Filed on 31-01-2018 03:50 PM PENDING   [SECTION:  XII ],  Category   1602-Family Law Matters : Other divorce matters, ,lakshmi,********,,,  Present/Last Listed On   19-02-2018  [ HON'BLE MR. JUSTICE KURIAN JOSEPH and HON'BLE MR. JUSTICE MOHAN M. SHANTANAGOUDAR ]
